{
  "$schema": "http://json-schema.org/draft-07/schema#",
  "title": "CredentialOfferMessage",
  "type": "object",
  "properties": {
    "@context": {
      "type": "array",
      "items": {
        "type": "string"
      }
    },
    "@type": {
      "type": "string"
    },
    "credentialIssuer": {
      "type": "string"
    },
    "credentials": {
      "type": "array",
      "items": {
        "anyOf": [
          { "type": "string" },
          { "$ref": "#/definitions/CredentialObject" }
        ]
      }
    }
  },
  "required": ["@context", "@type", "credentialIssuer", "credentials"],
  "definitions": {
    "CredentialObject": {
      "$ref": "CredentialObject.json"
    }
  }
}
