{
    "@context": ["https://w3id.org/tractusx-trust/v0.8", "http://example.org/context"],
    "@type": "CredentialOfferMessage",
    "credentialIssuer": "https://issuer.example.org",
    "credentials": [
      {
        "@context": "http://example.org/context",
        "@type": "UniversityDegreeCredential",
        "issuer": "https://issuer.example.org",
        "credentialSubject": {
          "id": "did:example:abcdef123456",
          "degree": {
            "type": "BachelorDegree",
            "name": "Bachelor of Science and Arts"
          }
        }
      }
    ]
  }
  